{"assertion_derivations":[{"binding_key":"independent-recomputation","derivation_class":"calculation","derivation_id":"rcid:v1:assertion-derivation:u7:01a08bfe-f086-7b3f-bc06-0ed1f691f052","derivation_revision_id":"rcid:v1:assertion-derivation-revision:h:jcs-sha256-v1:3df59ce23218dd7f5e3b38a81aa9c069a3c3a1842dee7bd6cd344fd6f5db8631","gate_kind":"structural-integrity"},{"binding_key":"gate-conjunction","derivation_class":"calculation","derivation_id":"rcid:v1:assertion-derivation:u7:01a07849-7263-7dc3-819e-a953edf1583a","derivation_revision_id":"rcid:v1:assertion-derivation-revision:h:jcs-sha256-v1:df951ea724e09fa6126b85a43613d7fe41e558c51a6197d72a2792a1aed8b95f","gate_kind":"structural-integrity"},{"binding_key":"artifact-integrity","derivation_class":"measurement","derivation_id":"rcid:v1:assertion-derivation:u7:01a07849-7263-7d1e-b3ab-fbae785e9704","derivation_revision_id":"rcid:v1:assertion-derivation-revision:h:jcs-sha256-v1:04c2f809a2a755f7e96221bc5914b4fd9b699b421390dc65a14b5ed5ae2304eb","gate_kind":"independent-evidence"},{"binding_key":"authority-boundary","derivation_class":"manual-decision","derivation_id":"rcid:v1:assertion-derivation:u7:01a07849-7263-7a47-adb6-32ef7f4fb541","derivation_revision_id":"rcid:v1:assertion-derivation-revision:h:jcs-sha256-v1:e4b6b65e2f04765113d8b24604d12fd45d8fc467d986b057f5e76ff1265879de","gate_kind":"governance-policy"}],"cardinality_audit":{"additional_independently_attributable_roles":988,"expanded_obligation_id_commitment":{"jcs_sha256":"834ced42dbb8fb2c36c69b88e225b0c0eb3e1960c3398e150445982f4f507340","member_count":988},"minimum_one_per_obligation":2390,"multi_role_obligations":988,"obligations":2390,"requirements":3378,"role_counts":{"boundary":120,"characterization":79,"negative":1394,"positive":1785},"single_role_obligations":1402,"unjustified_expansions":0},"checks":[{"check_id":"applicability-partitions","evidence":["obligations=1058+1332","requirements=1406+1972"],"status":"PASS"},{"check_id":"cardinality-expansion","evidence":["2390+988=3378","unjustified=0"],"status":"PASS"},{"check_id":"conditional-predicates","evidence":["conditional=1972","distinct=278","tautologies=0","contradictions=0","unknown-references=0"],"status":"PASS"},{"check_id":"derivation-contract","evidence":["rcid:v1:applicability-rule-set:h:jcs-sha256-v1:858aab11a14e4fc919f0980b8621f0067d1d8ed2299b838f04caacaff8009b43","scenario and orthogonal-axis vocabulary validated"],"status":"PASS"},{"check_id":"derivation-integrity","evidence":["all obligation and requirement derivation chains validated","evidence strength not escalated"],"status":"PASS"},{"check_id":"deterministic-regeneration","evidence":["manifest and gate report rebuild byte-identically from committed inputs"],"status":"PASS"},{"check_id":"evidence-role-partition","evidence":["positive=1785","negative=1394","boundary=120","characterization=79"],"status":"PASS"},{"check_id":"execution-accounting","evidence":["executable=3378","informative-overlap=307","prohibited=0","unresolved=0"],"status":"PASS"},{"check_id":"historical-denominator-immutability","evidence":["b25fbeaf80fc8e77f92fb5b36a094896bf30e86d4550ad62982f80a028b605b2","dab61b42376d757eadada26c31d8fb5c173a508bb6ce780e98a220449ce6e871","a03feacf51bf3af241a7ab4fe0ea74bd29981670de93ec3d880a27516232cca7"],"status":"PASS"},{"check_id":"identity-lineage","evidence":["identities=28016","all stable IDs and migration lineage validate"],"status":"PASS"},{"check_id":"independent-recomputation","evidence":["fresh snapshot-only recomputation=PASS","551b8f7e81cb60988e955825d0f42ca3b8a802bbbed0f21044a4641f2e9505e3"],"status":"PASS"},{"check_id":"migration-closure","evidence":["obligations=12048","requirements=9506","orphans=0"],"status":"PASS"},{"check_id":"multiplier-leakage","evidence":["current-authority unexplained multipliers=0","historical planning remains historical"],"status":"PASS"},{"check_id":"obligation-integrity","evidence":["2390/2390 identity, semantics, facet, archetype, operation, derivation, and explanation records valid"],"status":"PASS"},{"check_id":"obligation-population","evidence":["2390 canonical semantic obligations"],"status":"PASS"},{"check_id":"profile-expansion-deferral","evidence":["exact profiles=null","final logical executions=null","historical multiplier substituted=false"],"status":"PASS"},{"check_id":"requirement-integrity","evidence":["3378/3378 identity, attribution, purpose, evidence role, and cardinality records valid"],"status":"PASS"},{"check_id":"requirement-population","evidence":["3378 canonical minimum requirements"],"status":"PASS"},{"check_id":"scientific-purpose-partition","evidence":["conformance=3071","relational=228","characterization=79"],"status":"PASS"},{"check_id":"semantic-authority","evidence":["rcid:v1:ontology-snapshot:h:jcs-sha256-v1:4c9afcd3ea350a6f6c0a429d96fd6b10ca7d142300ce9a39e94809a1f383899e","scientific foundation=PASS","semantic foundation=PASS"],"status":"PASS"}],"claim_scope":"The semantic denominator is accepted as the authoritative basis for later oracle, vector, and applicability work; this is not repository-wide scientific certification or a profile-expanded execution count.","conditional_predicate_audit":{"capability_dimensions":{"profile.feature_scientific_ids":3526,"profile.manifestation_scientific_ids":761,"profile.modifier_scientific_ids":80,"profile.operation_scientific_ids":3378,"profile.semantic_variant_scientific_ids":186},"conditional_requirement_id_commitment":{"jcs_sha256":"35e35ed8a23ad94938d79d8d2ae2a511fb343dfcff0fe5760cb819cc700b2626","member_count":1972},"conditional_requirements":1972,"contradictions":0,"distinct_conditional_predicates":278,"distinct_predicates":354,"fixture_requirement_id":"rcid:v1:semantic-requirement:u7:01a08268-2465-704c-a071-84177da3bc2e","invalid_or_unresolved_references":0,"requirement_predicates":3378,"requirements_per_conditional_predicate":{"maximum":1025,"median":4,"minimum":2,"p95":5},"tautologies":0,"tri_state_fixtures":[{"expected":"applicable","fixture":"capability-true","observed":"applicable"},{"expected":"not-applicable","fixture":"capability-false","observed":"not-applicable"},{"expected":"unresolved","fixture":"capability-unknown","observed":"unresolved"}]},"current_c4":{"completed":0,"denominator":3378,"scientific_certification_issued":false,"status":"FAIL"},"exact_accounting":{"base_partitions":{"evidence_role":{"counts":{"boundary":120,"characterization":79,"negative":1394,"positive":1785},"cross_sum":3378},"execution_disposition":{"counts":{"executable-characterization":79,"executable-conformance":3071,"executable-relational":228,"non-executable-informative":0,"prohibited":0,"unresolved":0},"cross_sum":3378},"scientific_purpose":{"counts":{"characterization-only":79,"conformance-capable":3071,"relational/metamorphic-candidate":228},"cross_sum":3378},"semantic_applicability":{"counts":{"conditional":1972,"required":1406},"cross_sum":3378}},"obligations":{"characterization":79,"conditional":1332,"required":1058,"stable_id_commitment":{"jcs_sha256":"f93faac38c431bde170baa1e84929351b093037a84b7068ad4a3734b7c204e54","member_count":2390},"total":2390},"overlapping_rollups":{"executable":3378,"informative":307,"prohibited":0,"qualification":"These are named rollups over explicit base-axis members and must not be added to each other or to applicability counts.","unresolved":0},"requirements":{"characterization":79,"conditional":1972,"required":1406,"stable_id_commitment":{"jcs_sha256":"551b8f7e81cb60988e955825d0f42ca3b8a802bbbed0f21044a4641f2e9505e3","member_count":3378},"total":3378},"scenario_accounting":{"expected_status":"deferred-symbolic","obligations":{"conservative":2390,"expected":{"formula":"1058 + sum(P(profile facts satisfy predicate_o)) for 1332 conditional obligations","lower_bound":1058,"numeric_total":null,"upper_bound":2390},"lower":1058},"requirements":{"conservative":3378,"expected":{"formula":"1406 + sum(P(profile facts satisfy predicate_r)) for 1972 conditional requirements","lower_bound":1406,"numeric_total":null,"upper_bound":3378},"lower":1406}}},"explainability_audit":{"excluded_reconstructions":15,"facet_coverage":15,"included_reconstructions":62,"obligations_with_complete_chain":2390,"operation_coverage":33,"representative_chains":[{"cardinality_rule_revision_id":"rcid:v1:applicability-rule-set:h:jcs-sha256-v1:833c6355cc24d3fb6dec2f0a6868eff5c2e27fc33cb9b05824c2735845312837","denominator_classification":{"execution_disposition":"executable-conformance","semantic_applicability":"conditional"},"feature_scientific_id":"rcid:v1:feature:u7:01a077a2-0911-73b4-ba83-80697ad98190","obligation_scientific_id":"rcid:v1:obligation:u7:01a08268-1ea1-7a8f-9b83-a6bfb013b03f","requirement_scientific_id":"rcid:v1:semantic-requirement:u7:01a08268-2465-7f35-b88f-f5f24cd6202e","result":"PASS","rule_revision_id":"rcid:v1:applicability-rule-set:h:jcs-sha256-v1:6115c1e726383b6186a92601c48f8860e65b1b2aa6ca236be4feed3c42dfce4f","sample_axis":"evidence-role","sample_value":"boundary","semantic_assertion_revision_ids":["rcid:v1:finding-revision:h:jcs-sha256-v1:2e0d12f21c0b28da9259fe34a99e3089ba40dab39632aa049a1ded36d126be4e"]},{"cardinality_rule_revision_id":"rcid:v1:applicability-rule-set:h:jcs-sha256-v1:833c6355cc24d3fb6dec2f0a6868eff5c2e27fc33cb9b05824c2735845312837","denominator_classification":{"execution_disposition":"executable-characterization","semantic_applicability":"conditional"},"feature_scientific_id":"rcid:v1:feature:u7:01a07d96-a5ba-7758-9bd6-915ab0d89f6f","obligation_scientific_id":"rcid:v1:obligation:u7:01a08268-1e9a-7a84-8f42-43a486cb0e8a","requirement_scientific_id":"rcid:v1:semantic-requirement:u7:01a08268-2465-70c7-8d23-10086b047458","result":"PASS","rule_revision_id":"rcid:v1:applicability-rule-set:h:jcs-sha256-v1:228582c5cc1fd15cc0af9be9529e1ba64030501d34e5a02f72a7c75587624846","sample_axis":"evidence-role","sample_value":"characterization","semantic_assertion_revision_ids":["rcid:v1:finding-revision:h:jcs-sha256-v1:fee5d0d31f77d5341ba1dbf6fe